<!ELEMENT dataset (Bereiche|BackgroundURL)*>
<!ELEMENT Bereiche (Bereich)*>
<!ELEMENT Bereich (BereichID|BereichName)*>
<!ELEMENT BereichID (#PCDATA)>
<!ELEMENT BereichName (#PCDATA)>
<!ELEMENT BackgroundURL (#PCDATA)>